{
  "schema_version": "1",
  "id": "alro-YYYYMMDD-small-location-first-pass",
  "created_at": "",
  "live_record_id": "aurora-live-YYYYMMDD-small-location-first-pass",
  "live_record_path": "knowledge-inbox/aurora-live-records/aurora-live-YYYYMMDD-small-location-first-pass.json",
  "evidence_manifest_path": "knowledge-inbox/aurora-live-evidence-manifests/aurora-live-evidence-manifest-YYYYMMDD-small-location-first-pass.json",
  "reviewer": "",
  "outcome": "not-run",
  "decision_summary": "Review has not run yet.",
  "promotion_proposal_path": "",
  "reference_promotion_allowed": false,
  "accepted_atoms": [],
  "held_atoms": [],
  "rejected_atoms": [],
  "blocked_atoms": [],
  "visual_redaction_record_ids": [],
  "checks_run": [],
  "checks_passed": [],
  "privacy_findings": [],
  "schema_expansion_candidates": [],
  "next_actions": [
    "Run the Aurora live-record review checklist before generating a promotion proposal."
  ],
  "non_proof_boundaries": [
    "This outcome record proves maintainer process only.",
    "It does not prove Aurora Toolset behavior, NWN runtime behavior, or fresh Codex answer improvement."
  ],
  "notes": ""
}
